{
  "id": "residential.mortgages.mortgage-broker",
  "title": {
    "en": "Mortgage Broker",
    "tr": "Konut Kredisi Aracısı"
  },
  "abbreviation": "",
  "summary": {
    "en": "An intermediary who helps a borrower research and arrange mortgage products within the scope of their service.",
    "tr": "Borçlunun hizmet kapsamındaki konut kredisi ürünlerini araştırmasına ve düzenlemesine yardımcı olan aracıdır."
  },
  "simple_explanation": {
    "en": "An intermediary who helps a borrower research and arrange mortgage products within the scope of their service.",
    "tr": "Borçlunun hizmet kapsamındaki konut kredisi ürünlerini araştırmasına ve düzenlemesine yardımcı olan aracıdır."
  },
  "professional_explanation": {
    "en": "An intermediary who helps a borrower research and arrange mortgage products within the scope of their service. Its precise effect depends on the transaction, contract, evidence and jurisdiction.",
    "tr": "Borçlunun hizmet kapsamındaki konut kredisi ürünlerini araştırmasına ve düzenlemesine yardımcı olan aracıdır. Kesin etkisi işleme, sözleşmeye, kanıta ve hukuk bölgesine bağlıdır."
  },
  "real_world_example": {
    "en": "A homeowner, buyer, landlord or adviser records mortgage broker while reviewing a residential property decision.",
    "tr": "Bir ev sahibi, alıcı, kiraya veren veya danışman konut kararını incelerken konut kredisi aracısı konusunu kaydeder."
  },
  "office_example": {
    "en": "A property professional identifies the evidence, assumptions and responsible party before relying on mortgage broker.",
    "tr": "Taşınmaz uzmanı konut kredisi aracısı konusuna dayanmadan önce kanıtı, varsayımları ve sorumlu tarafı belirler."
  },
  "interview_questions": {
    "en": [
      {
        "question": "What is Mortgage Broker, and what should be verified?",
        "answer": "An intermediary who helps a borrower research and arrange mortgage products within the scope of their service. Verify the current document, evidence, contract and jurisdiction-specific requirements."
      }
    ],
    "tr": [
      {
        "question": "Konut Kredisi Aracısı nedir ve neler doğrulanmalıdır?",
        "answer": "Borçlunun hizmet kapsamındaki konut kredisi ürünlerini araştırmasına ve düzenlemesine yardımcı olan aracıdır. Güncel belgeyi, kanıtı, sözleşmeyi ve bölgeye özel gereklilikleri doğrulayın."
      }
    ]
  },
  "definition": {
    "en": "An intermediary who helps a borrower research and arrange mortgage products within the scope of their service.",
    "tr": "Borçlunun hizmet kapsamındaki konut kredisi ürünlerini araştırmasına ve düzenlemesine yardımcı olan aracıdır."
  },
  "category": {
    "key": "finance",
    "en": "Finance",
    "tr": "Finansman"
  },
  "subcategory": {
    "key": "mortgages",
    "en": "Mortgages and deposits",
    "tr": "Konut kredileri ve peşinat"
  },
  "aliases": {
    "en": [],
    "tr": []
  },
  "tags": ["residential-property", "mortgages", "pack-002"],
  "keywords": {
    "en": ["mortgage broker"],
    "tr": ["konut kredisi aracısı"]
  },
  "formula": null,
  "worked_example": {
    "en": "In a simple home review, the user records the relevant facts for mortgage broker, keeps the supporting document and flags anything requiring professional advice.",
    "tr": "Basit bir konut incelemesinde kullanıcı konut kredisi aracısı için ilgili bilgileri kaydeder, destekleyici belgeyi saklar ve uzman görüşü gerektiren konuları işaretler."
  },
  "when_to_use": {
    "en": "Use this concept when buying, owning, letting, managing, financing, improving or selling a home where it is relevant.",
    "tr": "Bu kavramı ilgili olduğu durumda konut alırken, sahip olurken, kiralarken, yönetirken, finanse ederken, iyileştirirken veya satarken kullanın."
  },
  "use_cases": {
    "en": [
      "Record and communicate mortgage broker in a residential decision file."
    ],
    "tr": [
      "Bir konut karar dosyasında konut kredisi aracısı konusunu kaydedip paylaşmak."
    ]
  },
  "risks": {
    "en": [
      "Definitions, contractual effects and legal requirements can differ by jurisdiction and change over time."
    ],
    "tr": [
      "Tanımlar, sözleşmesel etkiler ve hukuki gereklilikler bölgeye göre değişebilir ve zamanla güncellenebilir."
    ]
  },
  "common_mistakes": {
    "en": [
      "Relying on an informal description without checking the underlying document or current evidence."
    ],
    "tr": [
      "Dayanak belgeyi veya güncel kanıtı kontrol etmeden gayriresmî açıklamaya güvenmek."
    ]
  },
  "practical_tips": {
    "en": ["Keep dated evidence and record who verified it."],
    "tr": ["Tarihli kanıtı saklayın ve kimin doğruladığını kaydedin."]
  },
  "best_practice": {
    "en": [
      "Confirm material decisions with an appropriately qualified professional."
    ],
    "tr": ["Önemli kararları uygun nitelikte bir uzmanla doğrulayın."]
  },
  "uk_practice": {
    "en": "Use the cited UK guidance as a starting point and check the rules for the relevant UK nation and transaction date.",
    "tr": "Atıf verilen Birleşik Krallık rehberini başlangıç noktası olarak kullanın; ilgili ülke ve işlem tarihindeki kuralları kontrol edin."
  },
  "turkey_practice": {
    "en": "The UK concept may not map directly to Turkish law or market practice; obtain current local advice and use the Turkish title as an educational explanation.",
    "tr": "Birleşik Krallık kavramı Türk hukukuna veya piyasa uygulamasına bire bir karşılık gelmeyebilir; güncel yerel görüş alın ve Türkçe başlığı eğitim amaçlı açıklama olarak kullanın."
  },
  "related_concepts": [],
  "related_calculators": [],
  "related_documents": [],
  "related_standards": [],
  "related_regulations": [],
  "revision_history": [
    {
      "version": "1.0.0",
      "date": "2026-07-14",
      "summary": {
        "en": "Initial Pack 002 reviewed edition.",
        "tr": "İlk Pack 002 incelenmiş sürümü."
      },
      "reviewer": "EMCP Editorial Review"
    }
  ],
  "difficulty_level": "beginner",
  "estimated_reading_time_minutes": 4,
  "frequently_asked_questions": {
    "en": [
      {
        "question": "Is Mortgage Broker the same in every jurisdiction?",
        "answer": "No. Check the current local legal, contractual and professional context."
      }
    ],
    "tr": [
      {
        "question": "Konut Kredisi Aracısı her hukuk bölgesinde aynı mıdır?",
        "answer": "Hayır. Güncel yerel hukuki, sözleşmesel ve mesleki bağlamı kontrol edin."
      }
    ]
  },
  "visual_illustration": {
    "status": "planned",
    "caption": {
      "en": "A future diagram will illustrate mortgage broker.",
      "tr": "Gelecekteki bir şema konut kredisi aracısı konusunu gösterecektir."
    },
    "url": null
  },
  "future_video": {
    "status": "planned",
    "caption": {
      "en": "A future beginner video will explain mortgage broker.",
      "tr": "Gelecekteki başlangıç videosu konut kredisi aracısı konusunu açıklayacaktır."
    },
    "url": null
  },
  "jurisdiction": [
    "United Kingdom — educational overview",
    "Turkey — local professional verification required"
  ],
  "sources": [
    {
      "title": "Mortgages",
      "publisher": "MoneyHelper",
      "url": "https://www.moneyhelper.org.uk/en/homes/buying-a-home",
      "publication_date": null,
      "accessed_date": "2026-07-14",
      "citation_note": "Authoritative starting point for the mortgages and deposits scope; current transaction-specific requirements must be verified."
    }
  ],
  "created_date": "2026-07-14",
  "reviewed_date": "2026-07-14",
  "reviewer": "EMCP Editorial Review",
  "review_status": "reviewed",
  "content_version": "1.0.0"
}
