{
  "$schema": "../../../schemas/content-entry.schema.json",
  "id": "risks-inspections.building-survey",
  "title": {
    "en": "Building Survey",
    "tr": "Ayrıntılı Bina İncelemesi"
  },
  "summary": {
    "en": "A detailed professional inspection and report suited to properties needing deeper condition analysis.",
    "tr": "Daha derin durum analizi gereken taşınmazlara uygun ayrıntılı profesyonel inceleme ve rapordur."
  },
  "abbreviation": "",
  "definition": {
    "en": "A detailed professional inspection and report suited to properties needing deeper condition analysis. In professional work, its precise effect depends on the contract, evidence, valuation basis and rules applying to the property. Confirm jurisdiction-specific legal, tax, lending or technical consequences with a suitably qualified adviser.",
    "tr": "Daha derin durum analizi gereken taşınmazlara uygun ayrıntılı profesyonel inceleme ve rapordur. Profesyonel uygulamadaki kesin etkisi; sözleşmeye, kanıtlara, değerleme esasına ve taşınmaza uygulanan kurallara bağlıdır. Bölgeye özgü hukuk, vergi, kredi veya teknik sonuçları uygun nitelikte bir uzmanla teyit edin."
  },
  "category": {
    "key": "legal-review",
    "en": "Legal and Review",
    "tr": "Hukuk ve İnceleme"
  },
  "subcategory": {
    "key": "risks-inspections",
    "en": "Risks, inspections and due diligence",
    "tr": "Riskler ve incelemeler"
  },
  "aliases": {
    "en": [],
    "tr": []
  },
  "tags": ["risks-inspections", "content-pack-001", "fundamentals"],
  "keywords": {
    "en": ["building", "survey"],
    "tr": ["ayrıntılı", "bina", "incelemesi"]
  },
  "formula": null,
  "worked_example": {
    "en": "Example: before relying on “Building Survey” in a real decision, identify the property, relevant date, document or calculation scope, then verify the result against the cited guidance and transaction documents.",
    "tr": "Örnek: Gerçek bir kararda “Ayrıntılı Bina İncelemesi” kavramına dayanmadan önce taşınmazı, ilgili tarihi, belgeyi veya hesap kapsamını belirleyin; ardından sonucu kaynak gösterilen rehber ve işlem belgeleriyle doğrulayın."
  },
  "when_to_use": {
    "en": "Use this concept when reading, discussing or checking property work involving building survey.",
    "tr": "Bu kavramı ayrıntılı bina incelemesi içeren taşınmaz işlerini okurken, konuşurken veya kontrol ederken kullanın."
  },
  "use_cases": {
    "en": [
      "Understanding transaction documents",
      "Preparing questions for an adviser"
    ],
    "tr": [
      "İşlem belgelerini anlamak",
      "Bir uzmana sorulacak soruları hazırlamak"
    ]
  },
  "risks": {
    "en": [
      "Meaning and obligations can change by jurisdiction, date and contract wording."
    ],
    "tr": [
      "Anlam ve yükümlülükler bölgeye, tarihe ve sözleşme metnine göre değişebilir."
    ]
  },
  "common_mistakes": {
    "en": [
      "Treating a general explanation as a substitute for property-specific professional advice."
    ],
    "tr": [
      "Genel açıklamayı taşınmaza özel profesyonel tavsiyenin yerine koymak."
    ]
  },
  "related_concepts": [
    "risks-inspections.mortgage-valuation",
    "risks-inspections.damp"
  ],
  "related_calculators": [],
  "related_documents": [],
  "jurisdiction": ["United Kingdom (general; verify locally)"],
  "sources": [
    {
      "title": "House surveys",
      "publisher": "RICS",
      "url": "https://www.rics.org/consumer-guides/house-surveys-uk-the-costs-types-and-benefits-of-an-rics-home-survey",
      "publication_date": null,
      "accessed_date": "2026-07-14",
      "citation_note": "Authoritative or recognised professional guidance used for the definition and practical context of Building Survey; check the live source for updates."
    }
  ],
  "created_date": "2026-07-14",
  "reviewed_date": "2026-07-14",
  "reviewer": "EMCP Content Pack 001 source review",
  "review_status": "reviewed",
  "content_version": "1.1.0",
  "simple_explanation": {
    "en": "A detailed professional inspection and report suited to properties needing deeper condition analysis.",
    "tr": "Daha derin durum analizi gereken taşınmazlara uygun ayrıntılı profesyonel inceleme ve rapordur."
  },
  "professional_explanation": {
    "en": "A detailed professional inspection and report suited to properties needing deeper condition analysis. In professional work, its precise effect depends on the contract, evidence, valuation basis and rules applying to the property. Confirm jurisdiction-specific legal, tax, lending or technical consequences with a suitably qualified adviser.",
    "tr": "Daha derin durum analizi gereken taşınmazlara uygun ayrıntılı profesyonel inceleme ve rapordur. Profesyonel uygulamadaki kesin etkisi; sözleşmeye, kanıtlara, değerleme esasına ve taşınmaza uygulanan kurallara bağlıdır. Bölgeye özgü hukuk, vergi, kredi veya teknik sonuçları uygun nitelikte bir uzmanla teyit edin."
  },
  "real_world_example": {
    "en": "Example: before relying on “Building Survey” in a real decision, identify the property, relevant date, document or calculation scope, then verify the result against the cited guidance and transaction documents.",
    "tr": "Örnek: Gerçek bir kararda “Ayrıntılı Bina İncelemesi” kavramına dayanmadan önce taşınmazı, ilgili tarihi, belgeyi veya hesap kapsamını belirleyin; ardından sonucu kaynak gösterilen rehber ve işlem belgeleriyle doğrulayın."
  },
  "office_example": {
    "en": "Use this concept when reading, discussing or checking property work involving building survey.",
    "tr": "Bu kavramı ayrıntılı bina incelemesi içeren taşınmaz işlerini okurken, konuşurken veya kontrol ederken kullanın."
  },
  "interview_questions": {
    "en": [
      {
        "question": "What should be checked when using Building Survey?",
        "answer": "Check the current source, transaction documents, evidence and jurisdiction-specific requirements."
      }
    ],
    "tr": [
      {
        "question": "Ayrıntılı Bina İncelemesi kullanılırken neler kontrol edilmelidir?",
        "answer": "Güncel kaynağı, işlem belgelerini, kanıtı ve bölgeye özel gereklilikleri kontrol edin."
      }
    ]
  },
  "practical_tips": {
    "en": [
      "Understanding transaction documents",
      "Preparing questions for an adviser"
    ],
    "tr": [
      "İşlem belgelerini anlamak",
      "Bir uzmana sorulacak soruları hazırlamak"
    ]
  },
  "best_practice": {
    "en": [
      "Retain dated evidence and obtain qualified advice for material decisions."
    ],
    "tr": [
      "Tarihli kanıtı saklayın ve önemli kararlar için nitelikli uzman görüşü alın."
    ]
  },
  "uk_practice": {
    "en": "Check the current rules for the relevant UK nation and transaction date.",
    "tr": "İlgili Birleşik Krallık ülkesi ve işlem tarihi için güncel kuralları kontrol edin."
  },
  "turkey_practice": {
    "en": "Confirm the equivalent Turkish legal and market practice with a qualified local professional.",
    "tr": "Türkiye'deki karşılık gelen hukuk ve piyasa uygulamasını nitelikli yerel bir uzmanla doğrulayın."
  },
  "difficulty_level": "beginner",
  "estimated_reading_time_minutes": 4,
  "revision_history": [
    {
      "version": "1.1.0",
      "date": "2026-07-14",
      "summary": {
        "en": "Pack 002 residential learning enrichment.",
        "tr": "Pack 002 konut öğrenme zenginleştirmesi."
      },
      "reviewer": "EMCP Editorial Review"
    }
  ],
  "frequently_asked_questions": {
    "en": [
      {
        "question": "Does Building Survey work identically everywhere?",
        "answer": "No. Verify the current jurisdiction, documents and professional guidance."
      }
    ],
    "tr": [
      {
        "question": "Ayrıntılı Bina İncelemesi her yerde aynı şekilde mi uygulanır?",
        "answer": "Hayır. Güncel hukuk bölgesini, belgeleri ve mesleki rehberi doğrulayın."
      }
    ]
  },
  "visual_illustration": {
    "status": "planned",
    "caption": {
      "en": "Visual explanation planned.",
      "tr": "Görsel açıklama planlandı."
    },
    "url": null
  },
  "future_video": {
    "status": "planned",
    "caption": {
      "en": "Beginner video planned.",
      "tr": "Başlangıç videosu planlandı."
    },
    "url": null
  }
}
